<?xml version="1.0" encoding="utf-8"?>
<!--<!DOCTYPE Pacientes SYSTEM "DTDweb.dtd">--><?xml-stylesheet type="text/xsl" href="XSLTweb.xslt"?><Pacientes>
<!-- xmlns:xsi="http://www.w3.org/2001/XMLSchema-instance" xsi:noNamespaceSchemaLocation="XSDweb.xsd"-->

<Paciente>
      <ID>1234</ID>
      <Nombre>Ainara</Nombre>
      <Apellido>Lopez</Apellido>
      <Edad>20</Edad>
      <Sexo>Mujer</Sexo>
      <Foto>imagenes\foto_20250526_083803.jpg</Foto>
   </Paciente>
</Pacientes>